{
  "metadata": {
    "modelUsage": {
      "gemini/gemini-3.1-flash-lite": 25
    },
    "processingDate": "2026-06-25T00:00:00Z",
    "sourceFile": "farrell.2012.pdf",
    "totalPages": 27
  },
  "frontMatter": {
    "title": "The Ends of the Moral Virtues and the First Principles of Practical Reason in Thomas Aquinas",
    "authors": [
      { "name": "Dominic Farrell, L.C." }
    ]
  },
  "publication": {
    "publisher": "Gregorian & Biblical Press",
    "publisherLocation": "Roma",
    "series": "Premio Bellarmino, Facoltà di Filosofia",
    "isbn": "978-88-7839-230-4",
    "copyrightYear": 2012,
    "copyrightHolder": "Pontificio Istituto Biblico",
    "imprimatur": "Vidimus et approbamus ad normam Statutorum Universitatis Romae, ex Pontificia Universitate Gregoriana. Die 02/12/2011. Rev. P. Kevin Flannery. Rev. P. Jakub Gorczyca."
  },
  "pages": [
    {
      "id": "page-0001",
      "pageLabel": "1",
      "elements": [],
      "footnotes": []
    },
    {
      "id": "page-0002",
      "pageLabel": "3",
      "elements": [
        { "type": "paragraph", "id": "para-0001", "text": "<sc>Dominic Farrell, L.C.</sc>", "continuesFromPrevious": false, "continuesToNext": false },
        { "type": "paragraph", "id": "para-0002", "text": "<sc>The Ends of the Moral Virtues and the First Principles of Practical Reason in Thomas Aquinas</sc>", "continuesFromPrevious": false, "continuesToNext": false },
        { "type": "paragraph", "id": "para-0003", "text": "Premio Bellarmino Facoltà Filosofia", "continuesFromPrevious": false, "continuesToNext": false },
        { "type": "paragraph", "id": "para-0004", "text": "<sc>Gregorian & Biblical Press</sc>", "continuesFromPrevious": false, "continuesToNext": false }
      ],
      "footnotes": []
    },
    {
      "id": "page-0003",
      "pageLabel": "4",
      "elements": [
        { "type": "paragraph", "id": "para-0005", "text": "Vidimus et approbamus ad normam Statutorum Universitatis Romae, ex Pontificia Universitate Gregoriana", "continuesFromPrevious": false, "continuesToNext": false },
        { "type": "paragraph", "id": "para-0006", "text": "Die 02/12/2011", "continuesFromPrevious": false, "continuesToNext": false },
        { "type": "paragraph", "id": "para-0007", "text": "Rev. P. Kevin Flannery", "continuesFromPrevious": false, "continuesToNext": false },
        { "type": "paragraph", "id": "para-0008", "text": "Rev. P. Jakub Gorczyca", "continuesFromPrevious": false, "continuesToNext": false },
        { "type": "paragraph", "id": "para-0009", "text": "Progetto grafico di copertina: Serena Aureli", "continuesFromPrevious": false, "continuesToNext": false },
        { "type": "paragraph", "id": "para-0010", "text": "Impaginazione: Lisanti Srl - Roma", "continuesFromPrevious": false, "continuesToNext": false },
        { "type": "paragraph", "id": "para-0011", "text": "© 2012 Pontificio Istituto Biblico", "continuesFromPrevious": false, "continuesToNext": false },
        { "type": "paragraph", "id": "para-0012", "text": "Gregorian & Biblical Press", "continuesFromPrevious": false, "continuesToNext": false },
        { "type": "paragraph", "id": "para-0013", "text": "Piazza della Pilotta 35, 00187 - Roma", "continuesFromPrevious": false, "continuesToNext": false },
        { "type": "paragraph", "id": "para-0014", "text": "www.gbpress.net - books@biblicum.com", "continuesFromPrevious": false, "continuesToNext": false },
        { "type": "paragraph", "id": "para-0015", "text": "ISBN 978-88-7839-230-4", "continuesFromPrevious": false, "continuesToNext": false }
      ],
      "footnotes": []
    },
    {
      "id": "page-0004",
      "pageLabel": "5",
      "elements": [
        { "type": "paragraph", "id": "para-0016", "text": "To Mum and Dad.", "continuesFromPrevious": false, "continuesToNext": false },
        { "type": "blockQuote", "id": "quote-0001", "text": "“Remember that through your parents you were born; and what can you give back to them that equals their gift to you?” Sir 7:29", "continuesFromPrevious": false, "continuesToNext": false }
      ],
      "footnotes": []
    },
    {
      "id": "page-0005",
      "pageLabel": "7",
      "elements": [
        { "type": "heading", "id": "heading-0001", "level": 1, "text": "Contents" },
        { "type": "paragraph", "id": "para-0017", "text": "INTRODUCTION 11", "continuesFromPrevious": false, "continuesToNext": false },
        { "type": "paragraph", "id": "para-0018", "text": "1. Problems and Aims 11", "continuesFromPrevious": false, "continuesToNext": false },
        { "type": "paragraph", "id": "para-0019", "text": "2. Method and Limitations 18", "continuesFromPrevious": false, "continuesToNext": false },
        { "type": "paragraph", "id": "para-0020", "text": "3. Plan 21", "continuesFromPrevious": false, "continuesToNext": false },
        { "type": "paragraph", "id": "para-0021", "text": "4. References 24", "continuesFromPrevious": false, "continuesToNext": false },
        { "type": "paragraph", "id": "para-0022", "text": "5. Acknowledgements 25", "continuesFromPrevious": false, "continuesToNext": false },
        { "type": "paragraph", "id": "para-0023", "text": "PART I. NATURAL REASON AND THE PROXIMATE END OF THE MORAL VIRTUES", "continuesFromPrevious": false, "continuesToNext": false },
        { "type": "paragraph", "id": "para-0024", "text": "CHAPTER I: The Historical Background to Aquinas’ Position. Aristotelian Practical Wisdom and the Principles of Practical Reason in Early Thirteenth-Century Theology 29", "continuesFromPrevious": false, "continuesToNext": false },
        { "type": "paragraph", "id": "para-0025", "text": "1.1. Thirteenth-Century Theology and the Rehabilitation and Reshaping of Aristotelian Practical Wisdom 29", "continuesFromPrevious": false, "continuesToNext": false },
        { "type": "paragraph", "id": "para-0026", "text": "1.1.1 Thomas and a Problem in Aristotle’s Account of Practical Wisdom 29", "continuesFromPrevious": false, "continuesToNext": false },
        { "type": "paragraph", "id": "para-0027", "text": "1.1.2 The *status quaestionis* in the Early Thirteenth Century 33", "continuesFromPrevious": false, "continuesToNext": false },
        { "type": "paragraph", "id": "para-0028", "text": "1.2. William of Auxerre and Philip the Chancellor 37", "continuesFromPrevious": false, "continuesToNext": false },
        { "type": "paragraph", "id": "para-0029", "text": "1.2.1 William of Auxerre 37", "continuesFromPrevious": false, "continuesToNext": false },
        { "type": "paragraph", "id": "para-0030", "text": "1.2.2 Philip the Chancellor 45", "continuesFromPrevious": false, "continuesToNext": false },
        { "type": "paragraph", "id": "para-0031", "text": "1.3. Albert the Great 47", "continuesFromPrevious": false, "continuesToNext": false },
        { "type": "paragraph", "id": "para-0032", "text": "1.3.1 *De bono* 48", "continuesFromPrevious": false, "continuesToNext": false },
        { "type": "paragraph", "id": "para-0033", "text": "1.3.2 *Super Ethica* 52", "continuesFromPrevious": false, "continuesToNext": false }
      ],
      "footnotes": []
    },
    {
      "id": "page-0006",
      "pageLabel": "8",
      "elements": [
        { "type": "paragraph", "id": "para-0034", "text": "CHAPTER II: Aquinas’ Position on Natural Reason and the Ends of the Moral Virtues 67", "continuesFromPrevious": false, "continuesToNext": false },
        { "type": "paragraph", "id": "para-0035", "text": "2.1. The Ends of the Moral Virtues as Principles of Practical Reason 68", "continuesFromPrevious": false, "continuesToNext": false },
        { "type": "paragraph", "id": "para-0036", "text": "2.1.1 Ends as the Principles of Practical Reason 68", "continuesFromPrevious": false, "continuesToNext": false },
        { "type": "paragraph", "id": "para-0037", "text": "2.1.2 Aristotle on the Ends of the Moral Virtues as the Principles of Practical Wisdom 74", "continuesFromPrevious": false, "continuesToNext": false },
        { "type": "paragraph", "id": "para-0038", "text": "2.1.3 The Ends of the Virtues as Naturally Known First Principles of Practical Reason 77", "continuesFromPrevious": false, "continuesToNext": false },
        { "type": "paragraph", "id": "para-0039", "text": "2.2. Early Discussions 78", "continuesFromPrevious": false, "continuesToNext": false },
        { "type": "paragraph", "id": "para-0040", "text": "2.2.1 *Scriptum* III.33.2.3 78", "continuesFromPrevious": false, "continuesToNext": false },
        { "type": "paragraph", "id": "para-0041", "text": "2.2.2 *De veritate* 5.1 83", "continuesFromPrevious": false, "continuesToNext": false },
        { "type": "paragraph", "id": "para-0042", "text": "2.3. The Definitive Discussion: *Summa theologiae* II-II.47.6-7 85", "continuesFromPrevious": false, "continuesToNext": false },
        { "type": "paragraph", "id": "para-0043", "text": "2.3.1 Groundwork from the Prima Secundae 85", "continuesFromPrevious": false, "continuesToNext": false },
        { "type": "paragraph", "id": "para-0044", "text": "2.3.2 *Summa theologiae* II-II.47.6 87", "continuesFromPrevious": false, "continuesToNext": false },
        { "type": "paragraph", "id": "para-0045", "text": "2.2.3 *Summa theologiae* II-II.47.7 91", "continuesFromPrevious": false, "continuesToNext": false },
        { "type": "paragraph", "id": "para-0046", "text": "2.4. *Sententia libri Ethicorum*: Change or Continuity? 93", "continuesFromPrevious": false, "continuesToNext": false },
        { "type": "paragraph", "id": "para-0047", "text": "2.4.1 The Question about SLE: Continuity or Change? 93", "continuesFromPrevious": false, "continuesToNext": false },
        { "type": "paragraph", "id": "para-0048", "text": "2.4.2 On Naturally Understood First Principles of Practical Reason 96", "continuesFromPrevious": false, "continuesToNext": false },